<?xml version="1.0"?>
<!DOCTYPE AtlantisConfiguration SYSTEM "config.dtd">
<AtlantisConfiguration>
    <Initialization>
        <Interactions>
            <InteractionControl availableInDemoMode="YES" defaultInDemoMode="YES" projectionName="YX">
                <Panel fileName="ZMR" screenName="ZMR" toolTip="Zoom/Move/Rotate"/>
                <Panel fileName="RubberbandYX" screenName="RubberBand" toolTip="Rubberband Selection"/>
                <Panel fileName="Pick" screenName="Pick" toolTip="Show Info for Picked Item"/>
                <Panel fileName="SynchroCursors" screenName="SyncCursors" toolTip="Synchronised Cursors"/>
                <Panel fileName="FishEye" screenName="FishEye" toolTip="FishEye Transformation"/>
                <Panel fileName="Clock" screenName="Clock" toolTip="Clock Transformation"/>
                <Panel fileName="ScaleCopy" screenName="Scale" toolTip="Scale Interaction"/>
            </InteractionControl>
            <InteractionControl availableInDemoMode="YES" defaultInDemoMode="YES" projectionName="RZ">
                <Panel fileName="ZMR" screenName="ZMR" toolTip="Zoom/Move/Rotate"/>
                <Panel fileName="Rubberband" screenName="RubberBand" toolTip="Rubberband Selection"/>
                <Panel fileName="Pick" screenName="Pick" toolTip="Show Info for Picked Item"/>
                <Panel fileName="SynchroCursors" screenName="SyncCursors" toolTip="Synchronised Cursors"/>
                <Panel fileName="FishEye" screenName="FishEye" toolTip="FishEye Transformation"/>
                <Panel fileName="Skew" screenName="Skew" toolTip="Skew Interaction"/>
                <Panel fileName="ScaleCopy" screenName="Scale" toolTip="Scale Interaction"/>
            </InteractionControl>
            <InteractionControl availableInDemoMode="YES" defaultInDemoMode="NO" projectionName="XZ">
                <Panel fileName="ZMR" screenName="ZMR" toolTip="Zoom/Move/Rotate"/>
                <Panel fileName="Rubberband" screenName="RubberBand" toolTip="Rubberband Selection"/>
                <Panel fileName="Pick" screenName="Pick" toolTip="Show Info for Picked Item"/>
                <Panel fileName="SynchroCursors" screenName="SyncCursors" toolTip="Synchronised Cursors"/>
                <Panel fileName="FishEye" screenName="FishEye" toolTip="FishEye Transformation"/>
                <Panel fileName="ScaleCopy" screenName="Scale" toolTip="Scale Interaction"/>
            </InteractionControl>
            <InteractionControl availableInDemoMode="YES" defaultInDemoMode="NO" projectionName="YZ">
                <Panel fileName="ZMR" screenName="ZMR" toolTip="Zoom/Move/Rotate"/>
                <Panel fileName="Rubberband" screenName="RubberBand" toolTip="Rubberband Selection"/>
                <Panel fileName="Pick" screenName="Pick" toolTip="Show Info for Picked Item"/>
                <Panel fileName="SynchroCursors" screenName="SyncCursors" toolTip="Synchronised Cursors"/>
                <Panel fileName="FishEye" screenName="FishEye" toolTip="FishEye Transformation"/>
                <Panel fileName="ScaleCopy" screenName="Scale" toolTip="Scale Interaction"/>
            </InteractionControl>
            <InteractionControl availableInDemoMode="YES" defaultInDemoMode="NO" projectionName="FZ">
                <Panel fileName="ZMR" screenName="ZMR" toolTip="Zoom/Move/Rotate"/>
                <Panel fileName="Rubberband" screenName="RubberBand" toolTip="Rubberband Selection"/>
                <Panel fileName="Pick" screenName="Pick" toolTip="Show Info for Picked Item"/>
                <Panel fileName="SynchroCursors" screenName="SyncCursors" toolTip="Synchronised Cursors"/>
                <Panel fileName="FishEye" screenName="FishEye" toolTip="FishEye Transformation"/>
                <Panel fileName="Skew" screenName="Skew" toolTip="Skew Interaction"/>
                <Panel fileName="ScaleCopy" screenName="Scale" toolTip="Scale Interaction"/>
            </InteractionControl>
            <InteractionControl availableInDemoMode="YES" defaultInDemoMode="NO" projectionName="FR">
                <Panel fileName="ZMR" screenName="ZMR" toolTip="Zoom/Move/Rotate"/>
                <Panel fileName="RubberbandYX" screenName="RubberBand" toolTip="Rubberband Selection"/>
                <Panel fileName="Pick" screenName="Pick" toolTip="Show Info for Picked Item"/>
                <Panel fileName="SynchroCursors" screenName="SyncCursors" toolTip="Synchronised Cursors"/>
                <Panel fileName="FishEye" screenName="FishEye" toolTip="FishEye Transformation"/>
                <Panel fileName="Skew" screenName="Skew" toolTip="Skew Interaction"/>
                <Panel fileName="ScaleCopy" screenName="Scale" toolTip="Scale Interaction"/>
            </InteractionControl>
            <InteractionControl availableInDemoMode="YES" defaultInDemoMode="YES" projectionName="VP">
                <Panel fileName="VPSelection" screenName="RubberBand" toolTip="Rubberband Selection"/>
                <Panel fileName="Pick" screenName="Pick" toolTip="Show Info for Picked Item"/>
                <Panel fileName="ZMR" screenName="ZMR" toolTip="Zoom/Move/Rotate"/>
                <Panel fileName="SynchroCursors" screenName="SyncCursors" toolTip="Synchronised Cursors"/>
                <Panel fileName="ScaleCopy" screenName="Scale" toolTip="Scale Interaction"/>
            </InteractionControl>
            <InteractionControl availableInDemoMode="NO" defaultInDemoMode="NO" projectionName="3D">
                <Panel fileName="ZMR" screenName="ZMR" toolTip="Zoom/Move/Rotate"/>
                <Panel fileName="VPSelection" screenName="RubberBand" toolTip="Rubberband Selection"/>
                <Panel fileName="Pick" screenName="Pick" toolTip="Show Info for Picked Item"/>
                <Panel fileName="FishEye" screenName="FishEye" toolTip="FishEye Transformation"/>
                <Panel fileName="SynchroCursors" screenName="SyncCursors" toolTip="Synchronised Cursors"/>
                <Panel fileName="ScaleCopy" screenName="Scale" toolTip="Scale Interaction"/>
            </InteractionControl>
            <InteractionControl availableInDemoMode="NO" defaultInDemoMode="NO" projectionName="3DBox">
                <Panel fileName="3DBox" screenName="ZR" toolTip="Zoom/Rotate"/>
                <!-- temporarily remove "Pick" interaction for 3DBox until it is implemented
                <Panel fileName="Pick" screenName="Pick" toolTip="Show Info for Picked Item"/>
                -->
            </InteractionControl>
            <InteractionControl availableInDemoMode="YES" defaultInDemoMode="NO" projectionName="LegoPlot">
                <Panel fileName="ZMR" screenName="ZMR" toolTip="Zoom/Move/Rotate"/>
                <Panel fileName="SynchroCursors" screenName="SyncCursors" toolTip="Synchronised Cursors"/>
                <!-- temporarily remove "Pick" interaction for Lego until it is implemented
                <Panel fileName="Pick" screenName="Pick" toolTip="Show Info for Picked Item"/>
                -->
            </InteractionControl>
            <InteractionControl availableInDemoMode="NO" defaultInDemoMode="NO" projectionName="TrackResidual">
                <Panel fileName="Pick" screenName="Pick" toolTip="Show Info for Picked Item"/>
            </InteractionControl>
            <InteractionControl availableInDemoMode="YES" defaultInDemoMode="NO" projectionName="N3D">
                <Panel fileName="NZMR" screenName="Rotate" toolTip="Zoom/Move/Rotate"/>
            </InteractionControl>
            <InteractionControl availableInDemoMode="YES" defaultInDemoMode="NO" projectionName="NYX">
            </InteractionControl>
            <InteractionControl availableInDemoMode="YES" defaultInDemoMode="NO" projectionName="NPhysics">
                <Panel fileName="NZMR" screenName="Rotate" toolTip="Zoom/Move/Rotate"/>
            </InteractionControl>
            <InteractionControl availableInDemoMode="YES" defaultInDemoMode="NO" projectionName="EventInfo">
            </InteractionControl>
        </Interactions>
        <Canvas aspectRatio="NaN" startupLayout="SQUARE">
            <UsedWindow group="Data" name="1" projection="YX"/>
            <UsedWindow group="Data" name="2" projection="FR"/>
            <UsedWindow group="Data" name="3" projection="FZ"/>
            <UsedWindow group="Data" name="4" projection="YZ"/>
            <UsedWindow group="Data" name="5" projection="RZ"/>
            <UsedWindow group="Data" name="6" projection="VP"/>
            <UsedWindow group="Data" name="7" projection="XZ"/>
            <UsedWindow group="Data" name="8" projection="VP"/>
            <UsedWindow group="Data" name="9" projection="LegoPlot"/>
            <UsedWindow group="Data" name="L" projection="YX"/>
            <UsedWindow group="Data" name="M" projection="RZ"/>
            <UsedWindow group="Data" name="R" projection="VP"/>
            <UsedWindow group="Data" name="U" projection="YX"/>
            <UsedWindow group="Data" name="C" projection="FR"/>
            <UsedWindow group="Data" name="D" projection="RZ"/>
            <UsedWindow group="Data" name="E" projection="FZ"/>
            <UsedWindow group="Data" name="S" projection="YX"/>
            <UsedWindow group="Data" name="W" projection="YX"/>
            <UsedWindow group="Data" name="B" projection="RZ"/>
            <Layout name="LANDSCAPE" startup="S36" startupWindow="S">
                <Window hPos="0" height="1" name="1" vPos="0" width="1"/>
                <Window hPos="1" height="1" name="2" vPos="0" width="1"/>
                <Window hPos="2" height="1" name="3" vPos="0" width="1"/>
                <Window hPos="0" height="1" name="4" vPos="1" width="1"/>
                <Window hPos="1" height="1" name="5" vPos="1" width="1"/>
                <Window hPos="2" height="1" name="6" vPos="1" width="1"/>
                <Window hPos="0" height="2" name="L" vPos="0" width="1"/>